title,siglum,century,provenance,srclink,cursus,num_century
E-PAMan (Pamplona) partitura n. 58 olim 4/1,E-PAMan partitura n. 58 olim 4/1,12th century,,https://musicahispanica.eu/source/96965,,12
P-G (Guimarães) Arquivo Municipal Alfredo Pimenta N 043,P-G N 043,13th century,,https://pemdatabase.eu/source/80447,,13
"SK-KRE (Kremnica) Antiphonarium Grey file folder, nr. 2","SK-KRE Grey file folder, nr. 2",15th century,OFM,https://cantus.sk/source/32590,,15
A-KN Fragm. 446 Antiphonarium,A-KN Fragm. 446,12th century,?,https://austriamanus.org/source/114,,12
A-KN : Cod 73,A-KN Cod 73,13th century,"Autriche, Klosterneuburg",http://musmed.eu/source/17327,,13
"Porrentruy, Bibliothèque cantonale jurassienne, 18 (Bellelay Gradual)",CH-P 18,12th century,Bellelay Abbey,https://cantusdatabase.org/source/638308,Monastic,12
CZ-Pak (Praha) P VII,CZ-Pak P VII,14th century,Prague,https://cantusbohemiae.cz/source/11999,,14
CZ-Pn (Praha) XIII B 2,CZ-Pn XIII B 2,14th century,Bohemia,https://cantusbohemiae.cz/source/11621,,14
CZ-Pu (Praha) XIII A 5c,CZ-Pu XIII A 5c,15th century,Bohemia,https://cantusbohemiae.cz/source/11620,,15
CZ-R (Rajhrad) R 396,CZ-R R 396,13th century,Rajhrad,https://cantusbohemiae.cz/source/7157,,13
CZ-R (Rajhrad) R 418,CZ-R R 418,12th century,Břevnov monastery,https://cantusbohemiae.cz/source/11622,,12
D-B : Ms mus 40078,D-B Ms mus 40078,12th century,Quedlinburg,http://musmed.eu/source/8817,,12
D-BAa : Msc Lit 7,D-BAa Msc Lit 7,11th century,Seeon (Haute-Bavière),http://musmed.eu/source/8678,,11
D-DS : Hs 0545,D-DS Hs 0545,14th century,Bombogen (à Wittlich),http://musmed.eu/source/9518,,14
D-Ful : Aa 0006,D-Ful Aa 0006,12th century,Abbaye bénédictine de Weingarten,http://musmed.eu/source/9974,,12
D-Mbs : Clm 14965b,D-Mbs Clm 14965b,11th century,St. Michel de Bamberg > St-Emmeram de Regensburg,http://musmed.eu/source/12295,,11
E-Bbc (Barcelona) M 648,E-Bbc M 648,15th century,,https://musicahispanica.eu/source/20225,,15
E-Bbc (Barcelona) M 784,E-Bbc M 784,16th century,,https://musicahispanica.eu/source/20230,,16
F-LA : Ms 239,F-LA Ms 239,9th century,"France, Laon",http://musmed.eu/source/11599,,9
F-Pn : Lat. 10510,F-Pn Lat. 10510,11th century,Abbaye d’Echternach,http://musmed.eu/source/13330,,11
F-Pn : Lat. 10754,F-Pn Lat. 10754,10th century,Jésuites du Collège de Clermont à Paris,http://musmed.eu/source/13338,,10
H-Efkö MS I. 1 a-b – Graduale Strigoniense Thomae Card. Bakócz I-II.,H-Efkö MS I. 1 a-b,15th century,Esztergom,https://hun-chant.eu/source/1295,,15
RO-Sb Ms. 759 – Graduale Brassoviense,RO-Sb Ms. 759,15th century,Braşov,https://hun-chant.eu/source/1344,,15
"SK-BRa EC Lad. 3, EL 18 – Missale notatum Strigoniense","SK-BRa EC Lad. 3, EL 18",14th century,Bratislava,https://hun-chant.eu/source/1536,,14
SK-BRl (Bratislava) Rkp. 387 Missale Notatum,SK-BRl Rkp. 387,13th century,Scandinavia,https://cantus.sk/source/26226,,13
SK-BRnm (Bratislava) Cantionae sacrae,SK-BRnm MUS I 92,17th century,Slovensko - Bratislava,https://cantus.sk/source/22967,,17
"SK-KRE (Kremnica) Graduale Tom. 1, Fons 41, Fasc. 3, Nro. 54, 1582","SK-KRE Tom. 1, Fons 41, Fasc. 3, Nro. 54, 1582",15th century,Germany (OCist),https://cantus.sk/source/32517,,15
SK-Sk (Spišska Kapitula) Graduale Scepusiense,SK-Sk Graduale Scepusiense Nr.1,15th century,Slovakia,https://cantus.sk/source/6778,,15
"Trier, Stadtbibliothek Weberbach, Fragmentenbox 12b, Fragment 23-42, no. 40b","D-TRs Fragmentenbox 12b, Fragment 23-42, no. 40b",12th century,Germany,https://cantusdatabase.org/source/697865,,12
"SK-BRsa Arm. VI, Lad. 3, Fasc. 4, Nr. 8",SK-BRsa Palffy VI 3 4 8,14th century,Central Europe,https://cantus.sk/source/13700,,14
E-PAMan (Pamplona) Partitura n. 210,E-PAMan Partitura n. 210,13th century,,https://musicahispanica.eu/source/127525,,13
"E-SE, Antiphonale officii, Nº 25","E-SE, Nº 25",14th century,Segovia,https://musicahispanica.eu/source/19878,,14
E-TAha (Tarragona) Ms. 20/3 (olim Ms. 6.2),E-TAha Ms. 20/3 (olim Ms. 6.2),11th century,Nalec (Lleida),https://musicahispanica.eu/source/23209,,11
P-Cug (Coimbra) Biblioteca Geral da Universidade MM 1063 (78),P-Cug MM 1063 (78),13th century,,https://pemdatabase.eu/source/47287,unknown,13
F-Pn : NAL 1236 (2r-2v ; 179r-180v),F-Pn NAL 1236 (2r-2v ; 179r-180v),11th century,Nevers,http://musmed.eu/source/158279,Monastic,11
F-VN : Ms 0084,F-VN Ms 0084,12th century,Italie,http://musmed.eu/source/15488,Romanum,12
E-Mh (Madrid) Cód. 120,E-Mh Cód. 120,12th century,,https://musicahispanica.eu/source/111689,,12
"P-BRad (Braga) Arquivo Distrital Pasta de fragmentos, 052 (olim Caixa 249, nº 14)",P-BRad Pasta 052,12th century,,https://pemdatabase.eu/source/47221,,12
SK-BJ (Bardejov) Antiphonarium MMBJ 1805,SK-BJ (Bardejov) MMBJ 1805,14th century,Hungary,https://cantus.sk/source/29810,,14
P-Cug (Coimbra) Biblioteca Geral da Universidade MM 1063 (54),P-Cug MM 1063 (54),13th century,,https://pemdatabase.eu/source/98981,,13
P-VV (Vila Viçosa) Biblioteca do Palácio Real A.M. D-008,P-VV A.M. D-008,1622,,https://pemdatabase.eu/source/78886,,17
SK-BRsa Antiphonarium Scepusiense Protocol 1550-1557,SK-BRsa Spis 1550,15th century,Slovakia - Spišská Kapitula,https://cantus.sk/source/13837,,15
SK-TN (Trenčín) MMTN – Kn/I-32,SK-TN MMTN – Kn/I-32,15th century,Slovakia/Central Europe (?),https://cantus.sk/source/28829,,15
SK-Bra (Bratislava) EC Lad.2/45,SK-Bra ECLad.2/45,14th century,Slovakia,https://cantus.sk/source/10962,,14
E-VI (Vic) Fragmento V/6,E-VI Fragmento V/6,12th century,Archivo Capitular de Vic (Barcelona),https://musicahispanica.eu/source/111252,,12
GB-Ob : Ms Canon. Liturg. 0342,GB-Ob Ms Canon. Liturg. 0342,13th century,"Dalmatia, Ragusa (Dubrovnik), Abbaye Benedictine St Marie de Dubrovnik",http://musmed.eu/source/119661,,13
"H-Bn Clmae 172a, 172b – Graduale Cassoviense I-II","H-Bn Clmae 172a, 172b",16th century,Košice,https://hun-chant.eu/source/1314,,16
SK-Bra (Bratislava) EC Lad.1/2,SK-Bra ECLad.1/2,13th century,Germany,https://cantus.sk/source/10948,,13
"Kansas City (MO), University of Missouri-Kansas City - LaBudde Special Collections - Miller Nichols Library, M2147.C53 1500z (Adair Chant Book)",US-KClbsc M2147.C53 1500z,15th century (1475-1500),Spain,https://cantusdatabase.org/source/699262,Monastic,15
"Montréal, McGill University - Rare Books and Special Collections - Manuscript Collection, MS Medieval 0210",CDN-Mrb MS Medieval 0210,15th century (2nd half),Italy,https://cantusdatabase.org/source/693669,,15
P-BRs (Braga) Arquivo da Sé Frag. 003,P-BRs Frag. 003,15th cent.,,https://pemdatabase.eu/source/80224,Secular,15
P-G (Guimarães) Arquivo Municipal Alfredo Pimenta N 099,P-G N 099,13th cent.,,https://pemdatabase.eu/source/80538,Secular,13
SK-KREe (Kremnica) Antiphonarium 338,SK-KREe Antiphonarium 338,15th century,Poland,https://cantus.sk/source/32558,,15
"P-BRad (Braga) Arquivo Distrital Pasta de fragmentos, 036",P-BRad Pasta 036,early 13th century; early 16th century,,https://pemdatabase.eu/source/129866,Secular,13
P-BRam (Braga) Arquivo Municipal Nº 010 Códices,P-BRam Nº 010 Códices,12th - 13th cent.,,https://pemdatabase.eu/source/80147,Secular,12
F-Pn : Lat. 9436,F-Pn Lat. 9436,11th century,France Abbaye royale de Saint-Denis,http://musmed.eu/source/15586,,11
P-Cua (Coimbra) Arquivo Distrital e da Universidade III-1ªD-3-1-058 + III-1ªD-3-5-069 A,P-Cua III-1ªD-3-1-058 + III-1ªD-3-5-069 A,c. 1600,,https://pemdatabase.eu/source/118898,,17
SK-Brl (Bratislava) R 15301,SK-BRl R15301,15th century,Bohemia,https://cantus.sk/source/4993,,15
P-Cug (Coimbra) Biblioteca Geral da Universidade MM 1063 (83),P-Cug MM 1063 (83),16th century,,https://pemdatabase.eu/source/100132,,16
E-PAMan (Pamplona) Partitura n. 246,E-PAMan Partitura n. 246,16th century,,https://musicahispanica.eu/source/127909,,16
SK-BRnm (Bratislava) MUS I 14,SK-BRnm MUS I 14,14th century,Slovakia,https://cantus.sk/source/214,,14
E-PAMan (Pamplona) Partitura n. 154,E-PAMan Partitura n. 154,14th century,,https://musicahispanica.eu/source/127054,,14
E-PAMan (Pamplona) Partitura n. 177,E-PAMan Partitura n. 177,14th century,,https://musicahispanica.eu/source/127245,,14
"SK-KRE (Kremnica) Antiphonarium Tom. 2, Fons 23, Fasc. 1, Nro. 44, 1611","SK-KRE Tom. 2, Fons 23, Fasc. 1, Nro. 44, 1611",15th century,Germany,https://cantus.sk/source/32566,,15
D-BAa : Msc Bibl. 79,D-BAa Msc Bibl. 79,12th century,Allemagne,http://musmed.eu/source/8660,,12
V-CVbav : Archivio di San Pietro D.167,V-CVbav Archivio di San Pietro D.167,11th century,"Alsace, Wissembourg",http://musmed.eu/source/14729,,11
E-PAMan (Pamplona) partitura 100,E-PAMan partitura 100,13th century,,https://musicahispanica.eu/source/97888,,13
E-Mn (Madrid) U/908,E-Mn U/908,,,https://musicahispanica.eu/source/119266,,
E-SI (Santo Domingo de Silos) L2-e66,E-SI L2-e66,,Santo Domingo de Silos,https://musicahispanica.eu/source/119737,,
P-Cua (Coimbra) Arquivo Distrital e da Universidade IV-3ª Gav. 44 (15),P-Cua IV-3ª Gav. 44 (15),13th cent.,,https://pemdatabase.eu/source/97453,,13
E-PAMan (Pamplona) Partitura n. 256,E-PAMan Partitura n. 256,15th century,,https://musicahispanica.eu/source/128002,,15
E-PAMan (Pamplona) Partitura n. 268,E-PAMan Partitura n. 268,15th century,,https://musicahispanica.eu/source/128066,,15
E-PAMan (Pamplona) partitura n. 37 olim 3/5,E-PAMan partitura n. 37 olim 3/5,12th century,,https://musicahispanica.eu/source/96078,cathedral,12
E-PAMan (Pamplona) partitura n. 64 olim 5/1,E-PAMan partitura n. 64 olim 5/1,12th century,,https://musicahispanica.eu/source/97041,cathedral,12
E-PAMan (Pamplona) Partitura n. 120,E-PAMan Partitura n. 120,13th century,,https://musicahispanica.eu/source/126620,,13
P-EVad (Évora) Arquivo Distrital AHMEVR 098,P-EVad AHMEVR 098,13th century,,https://pemdatabase.eu/source/47263,Secular,13
F-Pn : Lat. 2142,F-Pn Lat. 2142,11th century,Abbaye cistercienne de Bonport (dioc. Evreux) ; Entra en 1732 à la Bibliothèque royale. Anc. cotes : Colbert 2784 ;Regius 4021,http://musmed.eu/source/13107,Monastic,11
SK-KE (Kežmarok) Breviarium 12257,SK-KE (Kežmarok) sign. 12257,13th century,Austria/Germany,https://cantus.sk/source/31675,,13
A-KN Fragm. 111 Breviarium,A-KN Fragm. 111,12th century,Austria/Germany,https://austriamanus.org/source/49,,12
"SK-KRE (Kremnica) Antiphonarium Tom. 1, Fons 41, Fasc. 5, Nro. 89, 1595","SK-KRE Tom. 1, Fons 41, Fasc. 5, Nro. 89, 1595",15th century,Bohemia,https://cantus.sk/source/32526,,15
E-Bbc (Barcelona) Ms. 3199,E-Bbc Ms. 3199,15th century,Cataluña,https://musicahispanica.eu/source/20252,,15
E-PAMan (Pamplona) Partitura n. 263,E-PAMan Partitura n. 263,16th century,,https://musicahispanica.eu/source/128052,,16
E-PAMan (Pamplona) Partitura n. 286,E-PAMan Partitura n. 286,16th century,,https://musicahispanica.eu/source/128216,,16
E-TUY (Tuy) Archivo Capitular de la Catedral de Tuy Fragmento 014,E-TUY Fragmento 014,c. 1400,"Tui (E), Catedral",https://pemdatabase.eu/source/72321,Secular,15
"SK-KRE (Kremnica) Antiphonarium Tom. 1, Fons 36, Fasc. 5, Nro. 110, 1553","SK-KRE Tom. 1, Fons 36, Fasc. 5, Nro. 110, 1553",15th century,medieval Hungary,https://cantus.sk/source/32454,,15
E-PAMan (Pamplona) Partitura n. 213,E-PAMan Partitura n. 213,13th century,,https://musicahispanica.eu/source/127550,,13
P-G (Guimarães) Arquivo Municipal Alfredo Pimenta C 1369,P-G C 1369,12th cent.,,https://pemdatabase.eu/source/80022,Secular,12
SK-BRnm (Bratislava) MUS I 6,SK-BRnm MUS I 6,15th century,Slovakia,https://cantus.sk/source/207,,15
SK-KE (Kežmarok) Antiphonarium Ms 1748 (MS Kž),SK-KE (Kežmarok) sign. Ms 1748 (MS Kž),14th century,Hungary (Spiš region),https://cantus.sk/source/31692,,14
P-VV (Vila Viçosa) Biblioteca do Palácio Real A.M. A-003,P-VV A.M. A-003,17th century,"Vila Viçosa, Capela Ducal",https://pemdatabase.eu/source/96558,unknown,17
A-KN CCl 0025 Antiphonarium (Fragm.),A-KN CCl. 25,12th century,Austria/Germany,https://austriamanus.org/source/3901,,12
A-KN CCl 0026 Graduale (Fragm.),A-KN CCl. 26,14th century,Klosterneuburg,https://austriamanus.org/source/4044,,14
CDN-Tu (Toronto) E-4 138,CDN-Tu E-4 138,16th century,Toledo Cathedral,https://musicahispanica.eu/source/111163,cathedral,16
CH-Cobodmer : C 0074,CH-Cobodmer C 0074,11th century,"Italie, Rome, Ste Cecilia in Trastevere",http://musmed.eu/source/9492,,11
CH-SGs : Cod 340,CH-SGs Cod 340,11th century,St Gallen,http://musmed.eu/source/14274,,11
CH-SGs : Cod 374,CH-SGs Cod 374,11th century,St Gallen,http://musmed.eu/source/14286,,11
CH-SGv : VadSlg Ms 0295,CH-SGv VadSlg Ms 0295,11th century,Kapelle Peter und Paul in Rotmonten bei St.Gallen,http://musmed.eu/source/14258,,11
D-BAa : Msc Lit 6,D-BAa Msc Lit 6,11th century,Regensburg St. Emmeram,http://musmed.eu/source/8677,,11
D-DS : Hs 1946,D-DS Hs 1946,11th century,"Belgique, Echternach",http://musmed.eu/source/9535,,11
D-Kl : Theol. quart 0015,D-Kl Theol. quart 0015,11th century,Kaufungen (puis entré en 1527 à la bibliothèque de Kassel),http://musmed.eu/source/11376,,11
D-Mbs : Clm 03005,D-Mbs Clm 03005,9th century,"Bavière, Andechs, Abbaye bénédictine d'Andechs",http://musmed.eu/source/12134,,9
F-AUT : Ms S 0010 (8*),F-AUT Ms S 0010 (8*),12th century,Autun,http://musmed.eu/source/8573,,12
F-CA : Ms 0075 (76),F-CA Ms 0075 (76),11th century,"France, Arras, Abbaye Saint-Vaast d'Arras",http://musmed.eu/source/9073,,11
F-LA : Ms 118,F-LA Ms 118,9th century,"France, Abbaye royale de Saint-Denis",http://musmed.eu/source/11594,,9
F-LA : Ms 236,F-LA Ms 236,11th century,Reims,http://musmed.eu/source/11597,,11
F-Pm : Ms 0384,F-Pm Ms 0384,11th century,Abbaye royale de Saint-Denis,http://musmed.eu/source/15589,Monastic,11
F-Pn : Lat. 2291,F-Pn Lat. 2291,9th century,Transporté à St-Germain-des-Prés à la fin du IXe,http://musmed.eu/source/13113,,9
F-Pn : Lat. 9449,F-Pn Lat. 9449,11th century,Nevers,http://musmed.eu/source/13297,,11
"Helsinki, The National Library of Finland (Suomen Kansalliskirjasto), F.m.I.26",FIN-Hy F.m.I.26,12th century (1175-1200),,https://cantusdatabase.org/source/711225,,12
I-BGc : MA 239 (Gamma III.18),I-BGc MA 239 (Gamma III.18),11th century,Brescia,http://musmed.eu/source/8805,,11
PL-Kl RL 1 Graduał wiślicki,PL-Kl RL 1,14th century,Wiślica,https://cantusplanus.pl/source/13732,,14
SK-BRsa (Bratislava) Slovenský národný archív - Graduale Nitriensis,SK-BRsa SNA 67,16th century,Slovakia - Nitra,https://cantus.sk/source/6776,,16
US-Baw : W.11,US-Baw W.11,11th century,Ravenne diocèse,http://musmed.eu/source/8646,,11
D-KNd : Ms 0081,D-KNd Ms 0081,11th century,Bas-Rhin/Allemagne ?,http://musmed.eu/source/11443,,11
D-Sl : Cod.Don.653,D-Sl Cod.Don.653,12th century,Ottobeuren,http://musmed.eu/source/14405,,12
E-Bbc (Barcelona) M 1408-13,E-Bbc M 1408-13,12th century,Provincia de Lleida,https://musicahispanica.eu/source/111047,,12
E-PAMan (Pamplona) Partitura n. 201,E-PAMan Partitura n. 201,13th century,,https://musicahispanica.eu/source/127480,,13
E-PAMan (Pamplona) Partitura n. 203,E-PAMan Partitura n. 203,13th century,,https://musicahispanica.eu/source/127488,,13
SK-BBa (Banská Bystrica) BREVIARIUM  VARIA / 51,SK-BBa (Banská Bystrica) BREVIARIUM VARIA / 51,14th century,Slovakia / medieval Hungary,https://cantus.sk/source/32187,,14
SK-BRu (Bratislava) Ms 1316,SK-BRu Ms1316,13th century,Central Europe,https://cantus.sk/source/5610,,13
SK-MO (Modra) Magistrát mesta Sv. Jur 5421 Waisenrechnungen 1637-1638,SK-MO Jur 5421,15th century,Slovakia,https://cantus.sk/source/200,,15
P-G (Guimarães) Arquivo Municipal Alfredo Pimenta P 627,P-G P 627,12th - 13th cent.,,https://pemdatabase.eu/source/80304,Secular,12
SK-BSa (Banská Štiavnica) Spitalls Raittung der Gemeiner Stadt Schemnitz 1600-1601 (sine Sign.),SK-BSa 1600-1601,14th century,Slovakia,https://cantus.sk/source/125,,14
E-SUe (Seo de Urgel) Fragmento 182.7,E-SUe Fragmento 182.7,12th century,,https://musicahispanica.eu/source/111472,,12
PL-Wn 12497 IV Graduale cisterciense,PL-Wn Rps 12497 IV,,"Cistercian, Silesia",https://cantusplanus.pl/source/35981,,
SK-KO (Košice) Antiphonarium H III/2 mac 16,SK-KO (Košice) H III/2 mac 16,15th century,Slovakia (medieval Hungary) Premonstratensians,https://cantus.sk/source/30730,,15
"P-BRad (Braga) Arquivo Distrital Pasta de fragmentos, 091 (olim Caixa 284, nº 7)",P-BRad Pasta 091,12th - 13th century,,https://pemdatabase.eu/source/47062,,12
P-BRam (Braga) Arquivo Municipal Nº 005 Códices,P-BRam Nº 005 Códices,12th - 13th cent.,,https://pemdatabase.eu/source/80199,unknown,12
"SK-BEt (Betliar) Slovenské národné múzeum - Múzeum Betliar 8 ANTIPHONARIUM Sign. K0000/08022, HK 08022",SK-BEt K0000/08022,15th century,Central Europe,https://cantus.sk/source/29074,,15
F-Pn (París) NAL 2199,F-Pn NAL 2199,10th century,"Preserved for long at Santo Domingo de Silos, as a flyleaves, but there is no indication of the place where it was copied (see Description"" above)""",https://musicahispanica.eu/source/20195,cathedral,10
A-KN Fragm. 005 Antiphonarium,A-KN Fragm. 5,12th century,Klosterneuburg,https://austriamanus.org/source/8,,12
D-Sl : Cod.theol.et.phil.fol.202,D-Sl Cod.theol.et.phil.fol.202,9th century,Sud de l'Allemagne,http://musmed.eu/source/14455,,9
A-KN Fragm. 007 Antiphonarium,A-KN Fragm. 7,12th century,Klosterneuburg,https://austriamanus.org/source/10,,12
CZ-OLu (Olomouc) M III 6,CZ-OLu M III 6,15th century,Moravia,https://cantusbohemiae.cz/source/11616,,15
SK-KE (Kežmarok) Antiphonarium 10727,SK-KE (Kežmarok) sign. 10727,15th century,Hungary (Spiš region),https://cantus.sk/source/31672,,15
P-Ln (Lisboa) Biblioteca Nacional de Portugal L.C. 243,P-Ln L.C. 243,16th century (first half),,https://pemdatabase.eu/source/103552,,16
SK-BRnm (Bratislava) MUS I 11,SK-BRnm MUS I 11,14th century,Slovakia,https://cantus.sk/source/211,,14
A-KN CCl 0865 Antiphonarium (Fragm.),A-KN CCl 0865,12th century,Austria/Germany,https://austriamanus.org/source/5604,,12
SK-TN (Trenčín) ZH-A Sine num.sig. (22),SK-TN ZH-A Sine num.sig. (22),15th century,Slovakia/Central Europe (?),https://cantus.sk/source/28834,,15
SK-BRnm (Bratislava) Slovenské národné múzeum - Hudobné múzeum Graduale,SK-BRnm MUS I 78,15th century,Moravia,https://cantus.sk/source/19263,,15
"New York City (NY), Butler Library - Rare Book and Manuscript Library, Western MS 097",US-NYcub Western MS 097,13th century (1275-1300),Dominican,https://cantusdatabase.org/source/706333,Secular,13
US-PHf : Lewis E 158,US-PHf Lewis E 158,13th century,"France, Paris",http://musmed.eu/source/98182,,13
E-PAMan (Pamplona) Partitura n. 302,E-PAMan Partitura n. 302,16th century,,https://musicahispanica.eu/source/128271,,16
E-PAMan (Pamplona) Partitura n. 304,E-PAMan Partitura n. 304,16th century,,https://musicahispanica.eu/source/128278,,16
E-Tc (Toledo) 74-7,E-Tc 74-7,16th century,,https://musicahispanica.eu/source/124670,,16
F-AI : Ms 0048,F-AI Ms 0048,11th century,Albi Cathédrale Sainte Cécile,http://musmed.eu/source/8388,,11
E-PAMan (Pamplona) Partitura n. 138,E-PAMan Partitura n. 138,12th century,,https://musicahispanica.eu/source/126846,,12
A-KN CCl 0022 Antiphonarium (Fragm.),A-KN CCl. 22,14th century,Klosterneuburg,https://austriamanus.org/source/3876,,14
SK-KO (Košice) Breviarium Fragm. MUSIC c,SK-KO (Košice) Fragm. MUSIC c,14th century,medieval Hungary (Spiš),https://cantus.sk/source/31279,,14
D-Mbs : Clm 00052,D-Mbs Clm 00052,9th century,Regensburg,http://musmed.eu/source/12104,,9
P-G (Guimarães) Arquivo Municipal Alfredo Pimenta N 022,P-G N 022,13th cent.,,https://pemdatabase.eu/source/80637,,13
SK-TN (Trenčín) MMTN – Kn/I-16,SK-TN MMTN – Kn/I-16,15th century,Moravia/ Slovakia: Nové Mesto nad Váhom (?),https://cantus.sk/source/28782,,15
E-PAMan (Pamplona) partitura n. 18 olim 1/19,E-PAMan partitura n. 18 olim 1/19,13th century,,https://musicahispanica.eu/source/94922,,13
SK-BJ (Bardejov) Antiphonarium MMBJ 1814,SK-BJ (Bardejov) MMBJ 1814,16th century,Hungary,https://cantus.sk/source/29807,,16
"SK-BSa (Banská Štiavnica) Copirbuch No.inv. 630, 1626",SK-BSa 630,15th century,Slovakia,https://cantus.sk/source/101,,15
E-PAMan (Pamplona) partitura n. 74 olim 4/2,E-PAMan partitura n. 74 olim 4/2,13th century,,https://musicahispanica.eu/source/97319,,13
"P-LOam (Loulé) Arquivo Municipal de Loulé Atas de Vereação, liv. 059","P-LOam Atas de Vereação, liv. 059",[c. 1400],,https://pemdatabase.eu/source/82701,Secular,15
D-Sl : HB VII 037,D-Sl HB VII 037,10th century,Constance ?,http://musmed.eu/source/14470,,10
SK-BRnm (Bratislava) D.2/2005,SK-BRnm D 2 2005,15th century,Slovakia,https://cantus.sk/source/219,,15
E-PAMan (Pamplona) Partitura n. 20 olim 2/1,E-PAMan Partitura n. 20 olim 2/1,12th century,,https://musicahispanica.eu/source/95175,,12
A-KN Fragm. 038 Antiphonarium,A-KN Fragm. 38,14th century,France,https://austriamanus.org/source/41,,14
SK-MO (Modra) Magistrát mesta Sv. Jur 5991 Inventar des Stadtweins 1612-1644,SK-MO Jur 5991,15th century,Slovakia,https://cantus.sk/source/201,,15
"Montréal, McGill University - Rare Books and Special Collections - Manuscript Collection, MS Medieval 0220",CDN-Mrb MS Medieval 0220,16th century,Spain,https://cantusdatabase.org/source/693748,,16
SK-KO (Košice) Antiphonarium H III/2 ar 5,SK-KO (Košice) H III/2 ar 5,15th century,Slovakia (medieval Hungary) Premonstratensians,https://cantus.sk/source/30725,,15
A-KN Fragm. 017,A-KN Fragm. 17,13th century,Austria/Germany,https://austriamanus.org/source/20,,13
"Princeton, Princeton University Library, 67.4",US-PRu 67.4,17th century,Toledo,https://cantusdatabase.org/source/1000050,,17
SK-Bra (Bratislava) EC Lad.1/22,SK-Bra ECLad.1/22,15th century,Central Europe,https://cantus.sk/source/10954,,15
CH-SGs : Cod 378,CH-SGs Cod 378,11th century,St Gallen,http://musmed.eu/source/14289,,11
CH-SGs : Cod 380,CH-SGs Cod 380,11th century,St Gallen,http://musmed.eu/source/14290,,11
D-TRp : Hs 187,D-TRp Hs 187,12th century,"Arrivé à bibliothèque de l'évêché de Trêve en 1921 , provenant de la succession de l'évêque Korum",http://musmed.eu/source/14562,,12
F-Pn : Lat. 18010,F-Pn Lat. 18010,11th century,Abbaye Saint-Corneille de Compiègne,http://musmed.eu/source/13514,,11
F-RS : Ms 0264,F-RS Ms 0264,13th century,Reims St Thierry,http://musmed.eu/source/14067,,13
F-SEm : Ms 018,F-SEm Ms 018,13th century,Abbaye Sainte-Colombe de Saint-Denis-lès-Sens (?) ou Abbaye Saint-Pierre-le-Vif de Sens (?),http://musmed.eu/source/20281,,13
F-Togs : Ms 001,F-Togs Ms 001,11th century,"France, Tours, collégiale Saint-Martin de Tours",http://musmed.eu/source/103078,,11
E-PAMan (Pamplona) partitura n. 101,E-PAMan partitura n. 101,11th century,,https://musicahispanica.eu/source/97908,,11
SK-MO (Modra) Magistrát mesta Modry 4925 Rechnungen des Kirchenvaters 1610-1615,SK-MO 4925,15th century,Slovakia,https://cantus.sk/source/178,,15
E-PAMan (Pamplona) Partitura n. 162,E-PAMan Partitura n. 162,14th century,,https://musicahispanica.eu/source/127119,,14
"Montréal, McGill University - Rare Books and Special Collections - Manuscript Collection, MS Medieval 0216",CDN-Mrb MS Medieval 0216,15th century,,https://cantusdatabase.org/source/693727,,15
E-PAMan (Pamplona) Partitura n. 130,E-PAMan Partitura n. 130,12th century,,https://musicahispanica.eu/source/126760,,12
SK-BRsa Antiphonarium Scepusiense sine Sign. Anni 1560,SK-BRsa Spis 1560,15th century,Slovakia - Spišská Kapitula,https://cantus.sk/source/13706,,15
D-KNd : Ms 0030,D-KNd Ms 0030,11th century,Abbaye d'Amorbach,http://musmed.eu/source/11434,,11
SK-KRE (Kremnica) Antiphonarium Haubt Raittung Gemainer Stadt 1621,SK-KRE Haubt Raittung Gemainer Stadt 1621,15th century,medieval Hungary/Buda,https://cantus.sk/source/32053,,15
E-PAMan (Pamplona) Partitura n. 139,E-PAMan Partitura n. 139,13th century,,https://musicahispanica.eu/source/126859,,13
SK-Bra (Bratislava) EC Lad.2/47,SK-Bra ECLad.2/47,15th century,Slovakia,https://cantus.sk/source/10964,,15
"SK-KRE (Kremnica) Antiphonarium Tom. 1, Fons 36, Fasc. 14, Nro. 672, 1594","SK-KRE Tom. 1, Fons 36, Fasc. 14, Nro. 672, 1594",15th century,Bohemia,https://cantus.sk/source/32485,,15
F-ME : Ms 732 bis (Pièce 02),F-ME Ms 732 bis (Pièce 02),13th century,Est de la France,http://musmed.eu/source/21673,Romanum,13
"P-BRad (Braga) Arquivo Distrital Pasta de fragmentos, 081 (olim Caixa 245, nº 13)",P-BRad Pasta 081,13th century (1st half),,https://pemdatabase.eu/source/47056,,13
SK-Bra (Bratislava) Antiphonary of Bratislava IIb EC Lad.4,SK-Bra IIb EC Lad.4,15th century,Bratislava,https://cantus.sk/source/13551,,15
SK-BRsa Antiphonarium Bibliotheca Capituli Posoniensis Manus. 86,SK-BRsa Manus.86,14th century,Slovakia / Hungary,https://cantus.sk/source/13891,,14
P-Cug (Coimbra) Biblioteca Geral da Universidade MM 1063 (85) + MM 1063 (50) + MM 1063 (84),P-Cug MM 1063 (85) + MM 1063 (50) + MM 1063 (84),early 16th century,,https://pemdatabase.eu/source/119050,,16
E-PAMan (Pamplona) Partitura n. 109,E-PAMan Partitura n. 109,12th century,,https://musicahispanica.eu/source/126470,,12
P-VV (Vila Viçosa) Biblioteca do Palácio Real A.M. D-002,P-VV A.M. D-002,17th century,,https://pemdatabase.eu/source/82918,Secular,17
E-PAMan (Pamplona) partitura n. 21 olim 2/2,E-PAMan partitura n. 21 olim 2/2,12th century,,https://musicahispanica.eu/source/95186,,12
E-Mh (Madrid) 3/487,E-Mh 3/487,16th century,Toledo,https://musicahispanica.eu/source/130128,Monastic,16
E-Mn (Madrid) ms. 17864 (Breviario de Calahorra),E-Mn ms. 17864 (Breviario de Calahorra),15th century,Calahorra,https://musicahispanica.eu/source/124223,,15
E-SI (Santo Domingo de Silos) Officia propria regula abbatiae Sancti Dominici de Silos O.S.B.,E-SI Officia propria regula abbatiae Sancti Dominici de Silos O.S.B.,,Roma,https://musicahispanica.eu/source/125112,,
E-Tc (Toledo) 74-11,E-Tc 74-11,16th century,Córdoba,https://musicahispanica.eu/source/124592,,16
"PL-Kk 48 Antyfonarz z Katedry Wawelskiej, de sanctis, pars hiemalis",PL-Kk ms. 48,15th century,Kraków,https://cantusplanus.pl/source/13734,,15
